{
  "version": 1,
  "source": {
    "requirements_path": "docs/requirements.md",
    "generated_at": "deterministic-dry-run"
  },
  "planner": {
    "mode": "deterministic_sample",
    "intended_production_planner": "GPT-5.5 extra-high reasoning via local Codex CLI/subscription",
    "note": "This sample plan is a regression fixture and demo output. Production decomposition should be performed by a high-reasoning planner, then validated and rendered by this harness."
  },
  "project": {
    "title": "Voice Transcription Harness Execution",
    "description": "Dependency-aware execution plan for building the native Windows 11 voice transcription app through coordinated agents.",
    "fields": [
      "Status",
      "Phase",
      "Agent",
      "Parallel Group",
      "Blocked By",
      "Review State",
      "CI State"
    ]
  },
  "labels": [
    {
      "name": "type:foundation",
      "color": "5319E7",
      "description": "Foundational work that unlocks later issues."
    },
    {
      "name": "type:implementation",
      "color": "0E8A16",
      "description": "Product or harness implementation work."
    },
    {
      "name": "type:research",
      "color": "FBCA04",
      "description": "Research or decision-support work."
    },
    {
      "name": "type:testing",
      "color": "1D76DB",
      "description": "Testing or validation work."
    },
    {
      "name": "type:documentation",
      "color": "6F42C1",
      "description": "Documentation work."
    },
    {
      "name": "area:windows-app",
      "color": "0078D4",
      "description": "Native Windows application area."
    },
    {
      "name": "area:provider",
      "color": "0B7285",
      "description": "Transcription provider architecture or implementation."
    },
    {
      "name": "area:ui",
      "color": "D93F0B",
      "description": "User interface and user experience work."
    },
    {
      "name": "area:ci",
      "color": "24292F",
      "description": "CI, test, or automation work."
    },
    {
      "name": "area:harness",
      "color": "8250DF",
      "description": "Harness orchestration system work."
    },
    {
      "name": "agent:codex",
      "color": "0969DA",
      "description": "Recommended for Codex."
    },
    {
      "name": "agent:claude",
      "color": "A855F7",
      "description": "Recommended for Claude Code."
    },
    {
      "name": "agent:either",
      "color": "BFDADC",
      "description": "Suitable for either agent."
    },
    {
      "name": "phase:0",
      "color": "D4C5F9",
      "description": "Harness and repository setup phase."
    },
    {
      "name": "phase:1",
      "color": "BFD4F2",
      "description": "Application foundation phase."
    },
    {
      "name": "phase:2",
      "color": "ACE5B1",
      "description": "Core transcription workflow phase."
    },
    {
      "name": "phase:3",
      "color": "FAD8C7",
      "description": "Provider and settings phase."
    },
    {
      "name": "phase:4",
      "color": "F2CC60",
      "description": "Polish, packaging, and release-readiness phase."
    },
    {
      "name": "priority:p0",
      "color": "B60205",
      "description": "Critical path."
    },
    {
      "name": "priority:p1",
      "color": "D1242F",
      "description": "High priority."
    },
    {
      "name": "priority:p2",
      "color": "FBCA04",
      "description": "Normal priority."
    },
    {
      "name": "status:ready",
      "color": "0E8A16",
      "description": "Ready for assignment."
    },
    {
      "name": "status:blocked",
      "color": "B60205",
      "description": "Blocked and needs attention."
    },
    {
      "name": "review:greptile",
      "color": "5319E7",
      "description": "Requires Greptile review handling."
    },
    {
      "name": "review:cross-agent",
      "color": "A855F7",
      "description": "Requires cross-agent review."
    },
    {
      "name": "ci:required",
      "color": "24292F",
      "description": "CI must pass before merge."
    }
  ],
  "milestones": [
    {
      "title": "M0 Harness Orchestration",
      "description": "Reusable harness artifacts, generation, validation, GitHub workflow, CI, and tmux orchestration."
    },
    {
      "title": "M1 Native Windows App Foundation",
      "description": "Windows App SDK/WinUI app shell, packaging, tray, startup, and settings foundation."
    },
    {
      "title": "M2 Recording And Insertion Workflow",
      "description": "Push-to-talk capture, HUD, active text insertion, clipboard fallback, and transcript history."
    },
    {
      "title": "M3 Provider Integrations",
      "description": "Provider abstraction, secure credentials, OpenAI, Mistral AI, and provider selection."
    },
    {
      "title": "M4 Polish And Release Readiness",
      "description": "Design polish, diagnostics, final CI coverage, packaging validation, and release documentation."
    }
  ],
  "issues": [
    {
      "id": "VT-001",
      "title": "Select native Windows app stack and repository structure",
      "milestone": "M1 Native Windows App Foundation",
      "phase": "phase:1",
      "parallel_group": "foundation",
      "agent": "codex",
      "labels": [
        "type:foundation",
        "area:windows-app",
        "agent:codex",
        "phase:1",
        "priority:p0",
        "ci:required",
        "review:cross-agent"
      ],
      "dependencies": [],
      "outcome": "Document and scaffold the chosen Windows App SDK/WinUI 3 solution structure without implementing app features.",
      "scope": [
        "Create the initial native Windows solution/project structure.",
        "Document Windows-side prerequisites required from WSL2.",
        "Keep the app target Windows 11 only."
      ],
      "acceptance_criteria": [
        "Repository contains a native Windows app skeleton plan or scaffold aligned with Windows App SDK and WinUI 3.",
        "Build prerequisites are documented for Windows 11.",
        "No Electron or browser-wrapper app shell is introduced."
      ],
      "review_plan": [
        "Codex implementation review for architecture and build viability.",
        "Claude review for native app UX implications."
      ],
      "ci_expectations": [
        "Harness validation passes.",
        "Future Windows build command is documented even if not yet runnable from WSL2."
      ],
      "notes": [],
      "execution": {
        "model": "GPT-5.5 via local Codex CLI, medium reasoning; escalate to high for architecture/security/API uncertainty",
        "reasoning_effort": "medium",
        "agent_command": "codex",
        "context_budget": "medium",
        "expected_files": [
          "src/**",
          "tests/**",
          "docs/** when implementation choices need explanation"
        ],
        "implementation_steps": [
          "Read docs/requirements.md and relevant ADRs before editing.",
          "Inspect existing code and tests before choosing an implementation shape.",
          "Implement: Create the initial native Windows solution/project structure.",
          "Implement: Document Windows-side prerequisites required from WSL2.",
          "Implement: Keep the app target Windows 11 only.",
          "Verify: Repository contains a native Windows app skeleton plan or scaffold aligned with Windows App SDK and WinUI 3.",
          "Verify: Build prerequisites are documented for Windows 11.",
          "Verify: No Electron or browser-wrapper app shell is introduced.",
          "Run the issue-specific test command and record the result in the PR.",
          "Open a focused PR that closes only this issue unless the issue explicitly says otherwise."
        ],
        "constraints": [
          "Do not make unrelated refactors.",
          "Do not introduce paid model API calls for orchestration.",
          "Preserve user changes and generated harness IDs.",
          "If a decision is low-risk and reversible, use judgment and document it.",
          "Keep the implementation native Windows 11; do not introduce Electron or a browser-wrapper shell."
        ],
        "failure_modes": [
          "Acceptance criteria are ambiguous after reading the requirements.",
          "Required local or Windows-side tool is missing.",
          "Implementation requires a product/security/architecture decision not already recorded."
        ]
      }
    },
    {
      "id": "VT-002",
      "title": "Add Windows packaging and startup foundation",
      "milestone": "M1 Native Windows App Foundation",
      "phase": "phase:1",
      "parallel_group": "foundation",
      "agent": "codex",
      "labels": [
        "type:foundation",
        "area:windows-app",
        "agent:codex",
        "phase:1",
        "priority:p0",
        "ci:required",
        "review:cross-agent"
      ],
      "dependencies": [
        "VT-001"
      ],
      "outcome": "Establish MSIX-first packaging and startup integration direction.",
      "scope": [
        "Add packaging project or documented packaging scaffold.",
        "Define startup toggle integration for the selected packaging model.",
        "Document signing and local developer constraints."
      ],
      "acceptance_criteria": [
        "Packaging is included from the start or a documented Windows App SDK blocker is recorded.",
        "Startup toggle path is documented and testable.",
        "CI strategy includes packaging validation expectations."
      ],
      "review_plan": [
        "Codex reviews Windows packaging correctness.",
        "Claude reviews settings/startup UX clarity."
      ],
      "ci_expectations": [
        "Packaging-related scripts or docs pass harness validation."
      ],
      "notes": [],
      "execution": {
        "model": "GPT-5.5 via local Codex CLI, medium reasoning; escalate to high for architecture/security/API uncertainty",
        "reasoning_effort": "medium",
        "agent_command": "codex",
        "context_budget": "medium",